### ISSUE TITLE
Installed but not working

### ISSUE THREAD

**Issue by darkverse** [M-o-a-T/venusian#26]
So I have finally got Venusian installed but it is not working. If I go to http://<myIPaddress> I get a welcome to nginx screen.

If I ssh into the RaspPi and run systemctl restart venusian@venus I get this message...
A dependency job for venusian@venus.service failed. See 'journalctl -xe' for details.

and looking through journalctl -xe all I can seem to find is...
Oct 29 14:59:43 rpi mount[28846]: unknown argument ignored: lazytime
Oct 29 14:59:43 rpi mount[28846]: unknown argument ignored: rw
Oct 29 14:59:43 rpi systemd[1]: venusian-initns@venus.service: Failed with result 'exit-code'.
░░ Subject: Unit failed
░░ Defined-By: systemd
░░ Support: https://www.debian.org/support
░░
░░ The unit venusian-initns@venus.service has entered the 'failed' state with result 'exit-code'.
Oct 29 14:59:43 rpi systemd[1]: Failed to start venusian-initns@venus.service - Init namespace for Venusian venus.

Is there anything else I need to run, install or do?

Update: I have tried to manually start the venusian-initns service with systemctl start venusian-initns@venus and that returns and error, checking with systemctl status venusian-initns@venus.service show this error...
Oct 29 15:33:53 rpi start-net[31451]: + touch /run/venusian/venus/initns
Oct 29 15:33:53 rpi start-net[31452]: touch: cannot touch '/run/venusian/venus/initns': No such file or directory
Oct 29 15:38:15 rpi start-net[31766]: ++ echo ERROR
Oct 29 15:38:15 rpi start-net[31766]: ERROR
Oct 29 15:38:15 rpi start-net[31766]: ++ exit 1

Update: I manually created the file /run/venusian/venus/initns and now that service starts. Now running systemctl start venusian@venus returns without an error but checking its status give...
Oct 29 15:51:51 rpi run-user[32795]: cannot resolve path /opt/venus/etc/venus
Oct 29 15:51:51 rpi run-user[32795]: cannot load store (null) at /opt/venus/etc/venus
Oct 29 15:51:51 rpi run-user[32795]: fuse-overlayfs: cannot read lower dirs: No such file or directory

and still nothing working.

Update: I created a symbolic link from /opt/venus to my mount point for the partition (/mnt/venusian) and now the venusian@venus service starts. Yay. So something must have messed up with the mount point and the DEST path.

But I still cant see anything, I have tried with and without the venusian-net service (I can get it to return the IP address but cannot view that from another machine on the network - I am ssh'd into the RasPi)

**Comment by smurfix** [comment]
I'll look at all of that today. Thanks for the effort you've all spent on this so far.

**Comment by darkverse** [comment]
After a fresh clone to incorporate #25 I am back to this situation. It seems like there is a problem with the flashmq install...
Error for 'plugin': /usr/libexec/flashmq/libflashmq-dbus-plugin.so is not there or not readable
... and attempting to install  dbus-flashmq still gives the dependency issues mentioned above.

**Comment by darkverse** [comment]
Great thanks, I will check that out. Appreciate it.
In the meantime, I managed to get something working with the current install - my setup is a bit convoluted so I am pairing it back to get each step working. I have a wifi network (so no eth0) and I am on a Windows machine ssh'd into the Raspi so I am first making sure the Raspi can view the Venus GUI... which it can now. 

I disabled venusian-net, started systemd-networkd, started venusian@venus, then reloaded systemd-networkd. The order seemed important. Now the network interfaces look good and on the Raspi I can browse to 192.168.42.1 and am presented with a Victron GX login page for the remoteconsole (not sure what the credentials are yet). I am just for now using sensible-browser to test on the Raspi but next step would be to get a browser on the windows machine to get to venus - I think it is close because if on the windows machine (192.168.43.222) I browse to http://192.168.43.198/venus it gets redirected to http://192.168.43.198/auth/login.php?page=/ but this returns a 404 not found error from nginx. (192.168.43.198 is the IP addr of the Raspi). Is this where venusian-net comes into it?

**Comment by smurfix** [comment]
> Is this where venusian-net comes into it?

Umm, partly. The Venusian installation sets up a local virtual network 192.168.42.x, with x=254 the host. When you start the Venus userspace it creates a network namespace and hooks a tunnel into that network.

Initially, i.e. after `systemctl start venusian-net`, this looks like
```
4: venusian: <NO-CARRIER,BROADCAST,MULTICAST,UP> mtu 1500 qdisc noqueue state DOWN group default qlen 1000
    inet 192.168.42.254/24 brd 192.168.42.255 scope global venusian
```
where the `NO-CARRIER` is intentional since no Venusisn userspace is up and running, and a network with only one host isn't very useful.

After `systemctl start venusian@venus` the networking looks like this
```
[…]
4: venusian: <BROADCAST,MULTICAST,UP,LOWER_UP> mtu 1500 qdisc noqueue state UP group default qlen 1000
    inet 192.168.42.254/24 brd 192.168.42.255 scope global venusian
5: venusian-venus@if2: <BROADCAST,MULTICAST,UP,LOWER_UP> mtu 1500 qdisc noqueue master venusian state UP group default qlen 1000
    link/ether c6:40:f4:d3:d5:9a brd ff:ff:ff:ff:ff:ff link-netns venusian-venus
    inet6 fe80::c440:f4ff:fed3:d59a/64 scope link proto kernel_ll
       valid_lft forever preferred_lft forever
```
That `venusian-venus` interface doesn't have an IP address on its own, which is intentional since it's just a slave interface, `master venusian`.

So when you enter the venus user's namespace, using `/usr/lib/venusian/bin/ven bash`, the network setup in there looks like this:
```
1: lo: <LOOPBACK,UP,LOWER_UP> mtu 65536 qdisc noqueue state UNKNOWN group default qlen 1000
    inet 127.0.0.1/8 scope host lo
2: eth0@if5: <BROADCAST,MULTICAST,UP,LOWER_UP> mtu 1500 qdisc noqueue state UP group default qlen 1000
    inet 192.168.42.1/24 scope global eth0
```
**and** if you add a free external IP address to your user when installing, using `--ext 10.107.3.60/25` in my case, which shows up here (you can of course add it later with your favorite text editor):
```
$ cat /etc/venusian/venus/vars
SCREEN=1
EXT=10.107.3.60/25
```
then `ip addr` lists that too:
```
3: eth1@if2: <BROADCAST,MULTICAST,UP,LOWER_UP> mtu 1500 qdisc noqueue state UP group default qlen 1000
    inet 10.107.3.60/25 scope global eth1
```
thus when I point my web browser to `http://10.107.3.60` I get that nice shiny new Venus GUI. Or the old one if I really want to, which frankly I don't.

**Comment by darkverse** [comment]
I pull the latest commit and ran but now I get a new error...
Updating user venus
Traceback (most recent call last):
  File "/home/mark/Documents/venusian/lib/bin/gen-pw", line 3, in <module>
    import bcrypt
ModuleNotFoundError: No module named 'bcrypt'

I assume I need to install that as a python module? maybe python3-bcrypt?

**Comment by smurfix** [comment]
> EXT=192.168.43.198/24 (which is the addr of the raspi host)

You need to use a free address on the same network which your default route uses. See `setup-netspace`.

Those @ifX entries in the `ip addr` output point to the appropriate interface in the "other" namespace. `if11` seems to tell me that your host network setup has a lot of interfaces which doesn't quite seem right. 

> if I go to 192.168.43.198/venus … `inet 192.168.43.100/25`

Wait, what? .100 is not in the same /25 network as .198. That can't work.

**Comment by darkverse** [comment]
Yeah I figured that out. I changed it to /24, same same.
Ok, I think I have narrowed it down to a configuration issue of nginx and the way  the proxy pass handles (or not) relative paths. This is because I get the first screen with a password request but then subsequent urls don't have the '/venus' location so they don't get passed to the proxy. I will look at it more tomorrow but I think changing the way the proxy pass is configured so it doesn't use a location but rather a port may do the trick. A job for tomorrow, storms are approaching. :-)

**Comment by darkverse** [comment]
I can't get anything working with EXT. As far as I can see the required routing is only available to a process using the netns venusian-venus. 

Turning again to nginx (which does use the netns) I have worked out how to get the reverse URLs to work correctly and can get the GUI to start to load but it gets connection errors. Looking in the console Isee this...
venus-gui-v2.js:8 WebSocket connection to 'ws://192.168.43.91/websocket-mqtt' failed: 

so not sure how to pass a websocket through nginx...

**Comment by smurfix** [comment]
Which flashmq (and dbus-flashmq) version are you using? I updated them a few days ago.

**Comment by darkverse** [comment]
Ok, I will try those suggestions. Also now that I have changed to using a router that has an ethernet port I could try a cable between the raspi and the router (though longer term I'd like to get the WLAN working).

I have more storms coming so not sure if I'll get a chance to do any more today.
Thanks for your patience and efforts.

**Comment by smurfix** [comment]
> Update:... thought about it ... I don't really want to embark on upgrading my whole system and all installed software to trixie so unless there is a version of (dbus-)flashmq that is compatible with bookworm then I think I am dead in the water for now :-(

I can build these for oldstable.

**Comment by smurfix** [comment]
Yes, on the raspi. Install "build-essential", then the above command line should work and you'll find the packages in …/ext.

That being said if you're on the raspi and replace the "stable" in `/etc/sources.list.d/venusian.list` with "oldstable" that should work too, in an hour or two. I'll add some lines to the install script to autodetect the OS release, but it won't replace an existing file.

**Comment by darkverse** [comment]
Ok, I might do that (wait a bit) I already have build-essential but that doesn't seem to include debuild (unknown command) and it seemed I needed devscripts but that was going to install a bunch of other stuff. I'll have a coffee and change venusian.list :-)
Thanks.

**Comment by darkverse** [comment]
BTW, my current venusian.list has the signed as smurf.archive.gpg but I had to copy that file to venusian.archive.gpg as it seemed to be updated elsewhere...I guess I should chenge that while I am at it and do I still need unstable and testing?

deb [signed-by=/etc/apt/trusted.gpg.d/smurf.archive.gpg] http://build.smurf.noris.de stable main
deb [signed-by=/etc/apt/trusted.gpg.d/smurf.archive.gpg] http://build.smurf.noris.de testing main
deb [signed-by=/etc/apt/trusted.gpg.d/smurf.archive.gpg] http://build.smurf.noris.de unstable main
deb [signed-by=/etc/apt/trusted.gpg.d/smurf.archive.gpg] http://build.smurf.noris.de smurf main

**Comment by darkverse** [comment]
Ok, thanks. In the meantime I have been investigating the EXT issue, I am starting to get my head around the whole ARP thing. 
I added a 192.168.43.100/32 route to the raspi (this is required) and also enabled proxy_arp (/proc/sys/net/ipv4/conf/all/proxy_arp) then I can ping from the raspi to .100 fine.
Then analysing the ARP traffic with tcpdump shows that the raspi is responding with the MAC address of the virtual interface inside the venusian-venus netns, ie eth1@if4. The pinging machine doesn't get the reply...or doesn't understand it...or doesn't know how to get to it

mark@rpi:~ $ sudo tcpdump -i wlan0 arp
tcpdump: verbose output suppressed, use -v[v]... for full protocol decode
listening on wlan0, link-type EN10MB (Ethernet), snapshot length 262144 bytes
12:41:02.827536 ARP, Request who-has rpi.home tell m.home, length 28
12:41:02.827653 ARP, Reply rpi.home is-at b8:27:eb:04:8a:d5 (oui Unknown), length 28
12:41:04.254997 ARP, Request who-has 192.168.43.100 tell Dugong.home, length 28
12:41:04.255212 ARP, **Reply 192.168.43.100 is-at 3a:84:96:99:af:74** (oui Unknown), length 28
12:41:05.285342 ARP, Request who-has 192.168.43.100 tell Dugong.home, length 28
12:41:05.285537 ARP, **Reply 192.168.43.100 is-at 3a:84:96:99:af:74** (oui Unknown), length 28

mark@rpi:~ $ sudo ip -n venusian-venus link
1: lo: <LOOPBACK,UP,LOWER_UP> mtu 65536 qdisc noqueue state UNKNOWN mode DEFAULT group default qlen 1000
    link/loopback 00:00:00:00:00:00 brd 00:00:00:00:00:00
2: eth0@if6: <BROADCAST,MULTICAST,UP,LOWER_UP> mtu 1500 qdisc noqueue state UP mode DEFAULT group default qlen 1000
    link/ether fa:cb:78:04:f9:6d brd ff:ff:ff:ff:ff:ff link-netnsid 0
3: eth1@if4: <BROADCAST,MULTICAST,UP,LOWER_UP> mtu 1500 qdisc noqueue state UP mode DEFAULT group default qlen 1000
    link/ether **3a:84:96:99:af:74** brd ff:ff:ff:ff:ff:ff link-netnsid 0

mark@rpi:~ $ ip link
1: lo: <LOOPBACK,UP,LOWER_UP> mtu 65536 qdisc noqueue state UNKNOWN mode DEFAULT group default qlen 1000
    link/loopback 00:00:00:00:00:00 brd 00:00:00:00:00:00
2: enxb827eb51df80: <NO-CARRIER,BROADCAST,MULTICAST,UP> mtu 1500 qdisc pfifo_fast state DOWN mode DEFAULT group default qlen 1000
    link/ether b8:27:eb:51:df:80 brd ff:ff:ff:ff:ff:ff
3: venusian: <BROADCAST,MULTICAST,PROMISC,UP,LOWER_UP> mtu 1500 qdisc noqueue state UP mode DEFAULT group default qlen 1000
    link/ether f2:4d:9b:e2:f8:59 brd ff:ff:ff:ff:ff:ff
4: wlan0: <BROADCAST,MULTICAST,PROMISC,UP,LOWER_UP> mtu 1500 qdisc pfifo_fast state UP mode DORMANT group default qlen 1000
    link/ether b8:27:eb:04:8a:d5 brd ff:ff:ff:ff:ff:ff
6: venusian-venus@if2: <BROADCAST,MULTICAST,UP,LOWER_UP> mtu 1500 qdisc noqueue master venusian state UP mode DEFAULT group default qlen 1000
    link/ether 6a:42:d1:c4:6b:99 brd ff:ff:ff:ff:ff:ff link-netns venusian-venus

**Comment by darkverse** [comment]
> Yes, on the raspi. Install "build-essential", then the above command line should work and you'll find the packages in …/ext.
> 
> That being said if you're on the raspi and replace the "stable" in `/etc/sources.list.d/venusian.list` with "oldstable" that should work too, in an hour or two. I'll add some lines to the install script to autodetect the OS release, but it won't replace an existing file.

I also had to install cmake and libssl-dev to get debuild to run (for flashmq build)...it starts but after about 6% the raspi hangs, completely unresponsive, so I think it just doesn't have the grunt to build it.

**Comment by darkverse** [comment]
Browsing to http://raspi-IP-addr/venus shows the gui and it attempts to load/connect but get transport errors (this is the same as the socket error I mentioned previously).

These are the errors in the browser console 
BackendConnection state: Victron::VenusOS::BackendConnection::Connecting
TransportConnecting, MQTT connection is:  QMqttClient::Disconnected
venus-gui-v2.js:8 WebSocket connection to 'ws://192.168.43.198/websocket-mqtt' failed: 
_emscripten_websocket_new @ venus-gui-v2.js:8Understand this error
MQTT client error: QMqttClient::TransportInvalid
BackendConnection state: Victron::VenusOS::BackendConnection::Disconnected
BackendConnection state: Victron::VenusOS::BackendConnection::Reconnecting
venus-gui-v2.js:8 TransportConnecting, MQTT connection is:  QMqttClient::Disconnected 

journalctl doesn't show errors related to this. It does have some errors re signalk and nodered but don't think they are relevant to this
rpi run[11023]: /opt/victronenergy/service/signalk-server/run: line 5: /usr/bin/prepare-signalk.sh: No such file or directory
rpi run[11042]: /opt/victronenergy/service/node-red-venus/run: line 5: /usr/bin/prepare-node-red-venus.sh: No such file or directory

**Comment by darkverse** [comment]
And further confirming that if the raspi is plugged into the router via an ethernet cable and I add a route to the EXT address then I can access the gui from another machine on the network (connected to the router via wifi) and it all works. I can also access and use the classic UI...not that I'll be doing that :-)
`raspi# ip ro add 192.168.43.100/32 dev venusian`

In the GUI (both v1 and v2) I couldn't find the options to turn off SignalK (when I had an SD card flashed with VenusOS itself) I could see that. I am pretty sure I installed 'large'. I have enabled Superuser access in the GUI. Does Venusian mask these services or am I missing something? I want to stop signalk because I already have it on the raspi - maybe I should just do that in the backend on the raspi?

**Comment by darkverse** [comment]
After a clean boot I can confirm that the extra route is not required. And it gets better... I realised that instead of joining the raspi to a wifi network if I set the raspi up as a wifi-hotspot and then join that network from my device (laptop/tablet/phone etc) then it all just works as expected, no need for the extra modem and ethernet cable, just go to 192.168.43.100 (as defined in EXT)

As this is all working we can close this long winded issue. Hopefully my ramblings and tribulations will be of help to any others who  encounter something similar.
